[
  {
    "id": "quran-demo-001",
    "domain": "quran",
    "topic": "القرآن الكريم",
    "level": "beginner",
    "type": "mcq",
    "question": "كم عدد سور القرآن الكريم؟",
    "options": ["110", "114", "120", "124"],
    "answer": "114",
    "explanation": "عدد سور القرآن الكريم 114 سورة.",
    "source": "المصحف الشريف",
    "sourceLocator": "فهرس السور",
    "rights": "reference-only",
    "status": "reviewed"
  },
  {
    "id": "hadith-demo-001",
    "domain": "hadith",
    "topic": "مصطلح الحديث",
    "level": "beginner",
    "type": "trueFalse",
    "question": "علم مصطلح الحديث يهتم بقواعد معرفة أحوال السند والمتن.",
    "options": ["صحيح", "خطأ"],
    "answer": "صحيح",
    "explanation": "هذا من صميم موضوع علم مصطلح الحديث، مع اختلاف صيغ التعريف بين العلماء.",
    "source": "موسوعة دين الله — مادة علوم الحديث",
    "rights": "reference-only",
    "status": "reviewed"
  }
]
